<?xml version="1.0" standalone="yes"?>
<!-- Copyright 2012-2013 Trento RISE Licensed under the Apache License, Version 
	2.0 (the "License"); you may not use this file except in compliance with 
	the License. You may obtain a copy of the License at http://www.apache.org/licenses/LICENSE-2.0 
	Unless required by applicable law or agreed to in writing, software distributed 
	under the License is distributed on an "AS IS" BASIS, WITHOUT WARRANTIES 
	OR CONDITIONS OF ANY KIND, either express or implied. See the License for 
	the specific language governing permissions and limitations under the License. -->
<service xmlns:xsi="http://www.w3.org/2001/XMLSchema-instance"
	xsi:noNamespaceSchemaLocation="../../../../resource.api/src/main/resources/jaxb/binding/resourceTemplateSchema.xsd">

	<resourceMapping uri="smartcampus.profile.basicprofile.me" pathPattern="/basicprofile/me"/>
  <resourceMapping uri="smartcampus.profile.accountprofile.me" pathPattern="/accountprofile/me"/>
	
    <resourceMapping uri="smartcampus.profile.basicprofile.all" pathPattern="/basicprofile/social/{socialId}"/>
    <resourceMapping uri="smartcampus.profile.basicprofile.all" pathPattern="/basicprofile/all/{userId}"/>
	  <resourceMapping uri="smartcampus.profile.basicprofile.all" pathPattern="/basicprofile/all"/>
    <resourceMapping uri="smartcampus.profile.basicprofile.all" pathPattern="/basicprofile/profiles"/>
    
    <resourceMapping uri="smartcampus.profile.accountprofile.all" pathPattern="/accountprofile/profiles"/>
    
</service>



